{
  "schemaVersion": "1.2.0",
  "manifestRevision": "0.3.0",
  "course": {
    "courseId": "python-in-de-klas",
    "courseRevisionId": "pidk-2026-08-17-r3",
    "title": "Python in de Klas",
    "language": "nl-BE"
  },
  "coordinateSpace": {
    "unit": "page_fraction",
    "origin": "top_left",
    "xAxis": "right",
    "yAxis": "down",
    "referenceBox": "rotated_crop_box"
  },
  "sourceNormalization": {
    "id": "word-code-v1",
    "encoding": "utf-8",
    "lineEndings": "lf",
    "terminalNewline": "absent",
    "trailingWhitespace": "preserve",
    "paragraphJoin": "single_lf",
    "nonCodeExclusions": "reviewed_line_slices_only"
  },
  "sources": {
    "docx": {
      "path": "source_materials/E_updated_syllabus_word.docx",
      "sha256": "502CCB39E8A8B2F8C3B2B2D983A70F0CB6D87729DC1B3CF17366782D9825E681",
      "bytes": 127388
    },
    "pdf": {
      "path": "source_materials/G_corrected_syllabus_pdf.pdf",
      "sha256": "AEDF8170AAC47E7FB453D8232AEDCF4540E0F372876D143F844F28B102066199",
      "bytes": 776114,
      "pageCount": 60
    }
  },
  "pages": [
    { "id": "pidk-page-f53712be-b922-500f-ac24-7295ab169497", "pageNumber": 1 },
    { "id": "pidk-page-56f7b5bb-d78b-5856-a058-58bc9a9ce10f", "pageNumber": 2 },
    { "id": "pidk-page-1e98d5cb-1bbe-545a-9fc5-87862311c0c1", "pageNumber": 3 },
    { "id": "pidk-page-7dda654f-a8d0-5284-81cf-a6c445313221", "pageNumber": 4 },
    { "id": "pidk-page-e725ca6c-56d1-5446-9f02-abfadc1acb74", "pageNumber": 5 },
    { "id": "pidk-page-37120f6d-d85a-5bf5-b8fa-9eca68212829", "pageNumber": 6 },
    { "id": "pidk-page-f7cd1355-92e0-5072-9e0f-4c96f707ae1b", "pageNumber": 7 },
    { "id": "pidk-page-349dc3d9-ef3d-52e4-b5d8-9350417c210b", "pageNumber": 8 },
    { "id": "pidk-page-9984dd81-0ce0-5d9c-8534-56193f38a85a", "pageNumber": 9 },
    { "id": "pidk-page-b2587e03-fe7e-591a-ad6e-65213013f6a8", "pageNumber": 10 },
    { "id": "pidk-page-3fa74e45-ed40-5dfa-8179-85091979ea1a", "pageNumber": 11 },
    { "id": "pidk-page-f9fcd43a-475a-53e8-a55e-5f2d3011ecb8", "pageNumber": 12 },
    { "id": "pidk-page-919ea4a9-8542-5093-be07-2a51d8bdb5a4", "pageNumber": 13 },
    { "id": "pidk-page-fb78abaa-698f-5fa1-b5ef-fa7d8e2a14ed", "pageNumber": 14 },
    { "id": "pidk-page-a50a80a4-89ce-5134-9c5a-491f1502d7ba", "pageNumber": 15 },
    { "id": "pidk-page-4274b854-9899-5de4-bd27-4d3b68bac379", "pageNumber": 16 },
    { "id": "pidk-page-59af9240-d452-5288-8fdd-fe7d71e9efa6", "pageNumber": 17 },
    { "id": "pidk-page-94dc8a22-f1c0-5887-b401-5c16cc2b48f0", "pageNumber": 18 },
    { "id": "pidk-page-8bfd8813-31f5-5645-ae2a-0e95ba17fe55", "pageNumber": 19 },
    { "id": "pidk-page-f12efbd6-f836-5330-b0e2-dbae87f144b1", "pageNumber": 20 },
    { "id": "pidk-page-b1280f71-420b-5908-b26b-fd77587af493", "pageNumber": 21 },
    { "id": "pidk-page-749561e6-2341-5b89-b025-0b512970c1c5", "pageNumber": 22 },
    { "id": "pidk-page-b8201dfc-9395-5ce2-9ba0-99cce2dc9038", "pageNumber": 23 },
    { "id": "pidk-page-11071ae7-d5bc-59a6-aeed-84006246016a", "pageNumber": 24 },
    { "id": "pidk-page-95515d3b-989d-5e64-b889-757831f8f6a7", "pageNumber": 25 },
    { "id": "pidk-page-0780391d-7d45-5404-b1c8-5dd20be6d536", "pageNumber": 26 },
    { "id": "pidk-page-a1ad40ab-f238-521f-83d2-aa4e9acebddf", "pageNumber": 27 },
    { "id": "pidk-page-c533bc85-81ce-59d6-8c16-46d665a722ab", "pageNumber": 28 },
    { "id": "pidk-page-e02a1839-95ac-5cc5-8c3d-fc3883efdbed", "pageNumber": 29 },
    { "id": "pidk-page-985e3f72-6967-526d-8042-601d86f76b88", "pageNumber": 30 },
    { "id": "pidk-page-6f89c49d-eb71-55c0-9ea8-929d1c580bd3", "pageNumber": 31 },
    { "id": "pidk-page-e0039f1d-e5ae-598e-85bd-a99be7a6223b", "pageNumber": 32 },
    { "id": "pidk-page-f95273b4-130e-5a1d-9dba-9f2b46923246", "pageNumber": 33 },
    { "id": "pidk-page-4eb9f63f-d2e8-569a-86fb-3ef3810d17c6", "pageNumber": 34 },
    { "id": "pidk-page-69e69f99-a908-598a-9e4e-d7104126462b", "pageNumber": 35 },
    { "id": "pidk-page-ccc12532-f126-5a46-b906-ea0fe49b8514", "pageNumber": 36 },
    { "id": "pidk-page-45f7379b-ac5b-503c-978d-980d5e196968", "pageNumber": 37 },
    { "id": "pidk-page-47ca0d56-45d7-54a9-942e-7ea71283d3a2", "pageNumber": 38 },
    { "id": "pidk-page-527903b3-e939-524f-aa2d-27f671b437a4", "pageNumber": 39 },
    { "id": "pidk-page-060eb7be-2c29-5ae0-b765-184ab2e86a85", "pageNumber": 40 },
    { "id": "pidk-page-10204cd6-c026-5e06-b062-ef393f22c9f3", "pageNumber": 41 },
    { "id": "pidk-page-112eb6bb-a569-590a-b037-fef99604438a", "pageNumber": 42 },
    { "id": "pidk-page-402c213b-a9d5-54b9-913d-46e90cb31c9b", "pageNumber": 43 },
    { "id": "pidk-page-45b10bf1-04ac-5142-9b59-18cdd631c393", "pageNumber": 44 },
    { "id": "pidk-page-f3b2af94-9b96-50f6-be92-1fae024949f7", "pageNumber": 45 },
    { "id": "pidk-page-9b2e79a5-b77b-50e6-8870-8d23bca0f5ab", "pageNumber": 46 },
    { "id": "pidk-page-8de1d10c-28a1-59dc-b7de-991dec96f16c", "pageNumber": 47 },
    { "id": "pidk-page-f4a4a02b-3b65-5464-9d4b-ffdd0d493c21", "pageNumber": 48 },
    { "id": "pidk-page-4f17527f-a3f0-55cb-8b77-2aaea58ad1a4", "pageNumber": 49 },
    { "id": "pidk-page-5eefc8c6-8665-5ae0-b1cc-96470c56c2c0", "pageNumber": 50 },
    { "id": "pidk-page-fdca9938-8056-5359-b8d9-611c43aeaeb9", "pageNumber": 51 },
    { "id": "pidk-page-aa290fef-1b21-5df4-8b3a-16fb10beac03", "pageNumber": 52 },
    { "id": "pidk-page-110f178e-13dc-5d55-b9bc-d52d68aefdf0", "pageNumber": 53 },
    { "id": "pidk-page-b614852c-164f-57f8-b223-b23ae4295fe4", "pageNumber": 54 },
    { "id": "pidk-page-42e22403-1e39-5177-936c-ce047e8712a2", "pageNumber": 55 },
    { "id": "pidk-page-b22d1490-5f92-5851-a37a-d464c991e04d", "pageNumber": 56 },
    { "id": "pidk-page-e9022d02-5829-5205-9a90-4af056cdb825", "pageNumber": 57 },
    { "id": "pidk-page-6402f989-283f-59fb-a583-2b7186199bd9", "pageNumber": 58 },
    { "id": "pidk-page-4c146da9-ca9d-52f4-8368-ab9fc2218d6f", "pageNumber": 59 },
    { "id": "pidk-page-d42dbd0b-99c4-51ff-91e8-1246c23783e6", "pageNumber": 60 }
  ],
  "chapters": [
    { "id": "pidk-chapter-3", "title": "De sequentie", "startPageNumber": 14, "endPageNumber": 21 },
    { "id": "pidk-chapter-4", "title": "De selectie", "startPageNumber": 22, "endPageNumber": 32 },
    { "id": "pidk-chapter-5", "title": "Herhalingen", "startPageNumber": 33, "endPageNumber": 53 }
  ],
  "snippets": [
    {
      "id": "pidk-c05-range-demo",
      "title": "Code 5.2 – bereik of range",
      "role": "demonstration",
      "source": {
        "pageId": "pidk-page-4eb9f63f-d2e8-569a-86fb-3ef3810d17c6",
        "pageIndex": 33,
        "pageNumber": 34,
        "heading": "Code 5.2 – bereik of range",
        "visibleCodeId": "5.2",
        "wordLocator": "body/p683 caption; body/p684 code"
      },
      "hotspot": {
        "rect": { "x": 0.114728, "y": 0.625131, "width": 0.761658, "height": 0.080340 },
        "buttonDock": "right_external_gutter_top",
        "accessibleLabel": "Open Code 5.2 – bereik of range in het Python-lab",
        "geometryReview": "reviewed"
      },
      "fragments": [
        {
          "id": "main",
          "label": "Bereik of range",
          "language": "python",
          "starterCode": "startjaar = int(input(\"Geef het startjaar in: \"))\nstartleeftijd = int(input(\"Geef de startleeftijd in: \"))\nfor i in range(3):\n    print(\"In\", startjaar + i, \"ben ik\", startleeftijd + i, \"jaar.\")",
          "sourceTextSha256": "04BCAD5C11A3DAE41F66B75781FFBA486518696EE0E80E9D38601EC88F289987",
          "sourceProvenance": {
            "sourceKind": "docx_body_paragraphs_zero_based",
            "normalizationId": "word-code-v1",
            "wordParagraphSlices": [{ "paragraphIndex": 684, "startLine": 1, "endLine": 4 }],
            "joinWith": "\n",
            "derivation": "exact_lines"
          },
          "editable": true,
          "execution": "enabled",
          "safetyClass": "standard",
          "outputPresentation": "standard",
          "editGuards": [],
          "expectedResult": {
            "kind": "exact_stdout",
            "fixtureId": "classroom-default",
            "stdout": "In 2024 ben ik 16 jaar.\nIn 2025 ben ik 17 jaar.\nIn 2026 ben ik 18 jaar.\n"
          }
        }
      ],
      "actions": ["open", "edit", "run", "reset", "diagnose", "reveal"],
      "runPolicy": {
        "autoRun": false,
        "freshGlobals": true,
        "timeoutMs": 5000,
        "standardLibrary": [],
        "input": {
          "mode": "queued",
          "defaultFixtureId": "classroom-default",
          "fixtures": [{ "id": "classroom-default", "label": "Startjaar 2024, leeftijd 16", "lines": ["2024", "16"] }]
        },
        "output": { "maxLines": 2000, "maxBytes": 262144 },
        "randomness": "none"
      },
      "revealPolicy": {
        "mode": "teacher_controlled",
        "levels": [{ "id": "expected-output", "fragmentId": "main", "kind": "expected_result", "label": "Toon de verwachte uitvoer", "content": "Drie regels voor 2024–2026 met leeftijden 16–18." }]
      },
      "reviewStatus": "reviewed"
    },
    {
      "id": "pidk-c04-boolean-prediction",
      "title": "Oefening 4.1 · Booleaanse uitdrukkingen voorspellen",
      "role": "prediction",
      "source": {
        "pageId": "pidk-page-11071ae7-d5bc-59a6-aeed-84006246016a",
        "pageIndex": 23,
        "pageNumber": 24,
        "heading": "Oefening 4.1 · Booleaanse uitdrukkingen voorspellen",
        "visibleExerciseId": "4.1",
        "wordLocator": "body/p536 heading; body/p538-p547 code and response region"
      },
      "hotspot": {
        "rect": { "x": 0.118961, "y": 0.215686, "width": 0.762061, "height": 0.552535 },
        "buttonDock": "right_external_gutter_top",
        "accessibleLabel": "Open Oefening 4.1 in het Python-lab",
        "geometryReview": "reviewed"
      },
      "sharedPrelude": {
        "id": "shared-prelude",
        "language": "python",
        "code": "a = 6\nb = 7",